,Series Code,Series Name
949,IC.TAX.METG,Number of visits or required meetings with tax officials (average for affected firms)
950,SH.MED.NUMW.P3,"Nurses and midwives (per 1,000 people)"
951,PA.NUS.FCRF,"Official exchange rate (LCU per US$, period average)"
952,NY.GDP.PETR.RT.ZS,Oil rents (% of GDP)
953,TX.VAL.MMTL.ZS.UN,Ores and metals exports (% of merchandise exports)
954,TM.VAL.MMTL.ZS.UN,Ores and metals imports (% of merchandise imports)
955,GC.XPN.OTHR.ZS,Other expense (% of expense)
956,GC.XPN.OTHR.CN,Other expense (current LCU)
957,EN.ATM.GHGO.ZG,Other greenhouse gas emissions (% change from 1990)
958,EN.ATM.GHGO.KT.CE,"Other greenhouse gas emissions, HFC, PFC and SF6 (thousand metric tons of CO2 equivalent)"
959,NV.MNF.OTHR.ZS.UN,Other manufacturing (% of value added in manufacturing)
960,GC.TAX.OTHR.RV.ZS,Other taxes (% of revenue)
961,GC.TAX.OTHR.CN,Other taxes (current LCU)
962,IC.TAX.OTHR.CP.ZS,Other taxes payable by businesses (% of commercial profits)
963,SH.XPD.OOPC.CH.ZS,Out-of-pocket expenditure (% of current health expenditure)
964,SH.XPD.OOPC.PC.CD,Out-of-pocket expenditure per capita (current US$)
965,SH.XPD.OOPC.PP.CD,"Out-of-pocket expenditure per capita, PPP (current international $)"
966,SE.PRM.OENR.ZS,"Over-age students, primary (% of enrollment)"
967,SE.PRM.OENR.FE.ZS,"Over-age students, primary, female (% of female enrollment)"
968,SE.PRM.OENR.MA.ZS,"Over-age students, primary, male (% of male enrollment)"
969,SL.TLF.PART.FE.ZS,"Part time employment, female (% of total female employment)"
970,SL.TLF.PART.MA.ZS,"Part time employment, male (% of total male employment)"
971,SL.TLF.PART.ZS,"Part time employment, total (% of total employment)"
972,IP.PAT.NRES,"Patent applications, nonresidents"
973,IP.PAT.RESD,"Patent applications, residents"
974,SH.STA.ODFC.ZS,People practicing open defecation (% of population)
975,SH.STA.ODFC.RU.ZS,"People practicing open defecation, rural (% of rural population)"
976,SH.STA.ODFC.UR.ZS,"People practicing open defecation, urban (% of urban population)"
977,SH.H2O.BASW.ZS,People using at least basic drinking water services (% of population)
978,SH.H2O.BASW.RU.ZS,"People using at least basic drinking water services, rural (% of rural population)"
979,SH.H2O.BASW.UR.ZS,"People using at least basic drinking water services, urban (% of urban population)"
980,SH.STA.BASS.ZS,People using at least basic sanitation services (% of population)
981,SH.STA.BASS.RU.ZS,"People using at least basic sanitation services, rural (% of rural population)"
982,SH.STA.BASS.UR.ZS,"People using at least basic sanitation services, urban (% of urban population)"
983,SH.H2O.SMDW.ZS,People using safely managed drinking water services (% of population)
984,SH.H2O.SMDW.RU.ZS,"People using safely managed drinking water services, rural (% of rural population)"
985,SH.H2O.SMDW.UR.ZS,"People using safely managed drinking water services, urban (% of urban population)"
986,SH.STA.SMSS.ZS,People using safely managed sanitation services (% of population)
987,SH.STA.SMSS.RU.ZS,"People using safely managed sanitation services, rural (% of rural population)"
988,SH.STA.SMSS.UR.ZS,"People using safely managed sanitation services, urban (% of urban population)"
989,SH.STA.HYGN.ZS,People with basic handwashing facilities including soap and water (% of population)
990,SH.STA.HYGN.RU.ZS,"People with basic handwashing facilities including soap and water, rural (% of rural population)"
991,SH.STA.HYGN.UR.ZS,"People with basic handwashing facilities including soap and water, urban (% of urban population)"
992,IQ.SCI.PRDC,Periodicity and timeliness assessment of statistical capacity (scale 0 - 100)
993,AG.LND.CROP.ZS,Permanent cropland (% of land area)
994,SE.PRM.PRS5.FE.ZS,"Persistence to grade 5, female (% of cohort)"
995,SE.PRM.PRS5.MA.ZS,"Persistence to grade 5, male (% of cohort)"
996,SE.PRM.PRS5.ZS,"Persistence to grade 5, total (% of cohort)"
997,SE.PRM.PRSL.FE.ZS,"Persistence to last grade of primary, female (% of cohort)"
998,SE.PRM.PRSL.MA.ZS,"Persistence to last grade of primary, male (% of cohort)"
999,SE.PRM.PRSL.ZS,"Persistence to last grade of primary, total (% of cohort)"
1000,BM.TRF.PWKR.CD.DT,"Personal remittances, paid (current US$)"
1001,BX.TRF.PWKR.DT.GD.ZS,"Personal remittances, received (% of GDP)"
1002,BX.TRF.PWKR.CD.DT,"Personal remittances, received (current US$)"
1003,BX.TRF.PWKR.CD,"Personal transfers, receipts (BoP, current US$)"
1004,EN.ATM.PFCG.KT.CE,PFC gas emissions (thousand metric tons of CO2 equivalent)
1005,SH.MED.PHYS.ZS,"Physicians (per 1,000 people)"
1006,EN.HPT.THRD.NO,"Plant species (higher), threatened"
1007,EN.ATM.PM25.MC.M3,"PM2.5 air pollution, mean annual exposure (micrograms per cubic meter)"
1008,EN.ATM.PM25.MC.ZS,"PM2.5 air pollution, population exposed to levels exceeding WHO guideline value (% of total)"
1009,EN.ATM.PM25.MC.T1.ZS,"PM2.5 pollution, population exposed to levels exceeding WHO Interim Target-1 value (% of total)"
1010,EN.ATM.PM25.MC.T2.ZS,"PM2.5 pollution, population exposed to levels exceeding WHO Interim Target-2 value (% of total)"
1011,EN.ATM.PM25.MC.T3.ZS,"PM2.5 pollution, population exposed to levels exceeding WHO Interim Target-3 value (% of total)"
1012,DT.NFL.PNGB.CD,"PNG, bonds (NFL, current US$)"
1013,DT.NFL.PNGC.CD,"PNG, commercial banks and other creditors (NFL, current US$)"
1014,PV.EST,Political Stability and Absence of Violence/Terrorism: Estimate
1015,PV.NO.SRC,Political Stability and Absence of Violence/Terrorism: Number of Sources
1016,PV.PER.RNK,Political Stability and Absence of Violence/Terrorism: Percentile Rank
1017,PV.PER.RNK.LOWER,"Political Stability and Absence of Violence/Terrorism: Percentile Rank, Lower Bound of 90% Confidence Interval"
1018,PV.PER.RNK.UPPER,"Political Stability and Absence of Violence/Terrorism: Percentile Rank, Upper Bound of 90% Confidence Interval"
1019,PV.STD.ERR,Political Stability and Absence of Violence/Terrorism: Standard Error
1020,SP.POP.0004.FE.5Y,"Population ages 00-04, female (% of female population)"
1021,SP.POP.0004.MA.5Y,"Population ages 00-04, male (% of male population)"
1022,SP.POP.0014.TO.ZS,Population ages 0-14 (% of total population)
1023,SP.POP.0014.FE.IN,"Population ages 0-14, female"
1024,SP.POP.0014.FE.ZS,"Population ages 0-14, female (% of female population)"
1025,SP.POP.0014.MA.IN,"Population ages 0-14, male"
1026,SP.POP.0014.MA.ZS,"Population ages 0-14, male (% of male population)"
1027,SP.POP.0014.TO,"Population ages 0-14, total"
1028,SP.POP.0509.FE.5Y,"Population ages 05-09, female (% of female population)"
1029,SP.POP.0509.MA.5Y,"Population ages 05-09, male (% of male population)"
1030,SP.POP.1014.FE.5Y,"Population ages 10-14, female (% of female population)"
1031,SP.POP.1014.MA.5Y,"Population ages 10-14, male (% of male population)"
1032,SP.POP.1519.FE.5Y,"Population ages 15-19, female (% of female population)"
1033,SP.POP.1519.MA.5Y,"Population ages 15-19, male (% of male population)"
1034,SP.POP.1564.TO.ZS,Population ages 15-64 (% of total population)
1035,SP.POP.1564.FE.IN,"Population ages 15-64, female"
1036,SP.POP.1564.FE.ZS,"Population ages 15-64, female (% of female population)"
1037,SP.POP.1564.MA.IN,"Population ages 15-64, male"
1038,SP.POP.1564.MA.ZS,"Population ages 15-64, male (% of male population)"
1039,SP.POP.1564.TO,"Population ages 15-64, total"
1040,SP.POP.2024.FE.5Y,"Population ages 20-24, female (% of female population)"
1041,SP.POP.2024.MA.5Y,"Population ages 20-24, male (% of male population)"
1042,SP.POP.2529.FE.5Y,"Population ages 25-29, female (% of female population)"
1043,SP.POP.2529.MA.5Y,"Population ages 25-29, male (% of male population)"
1044,SP.POP.3034.FE.5Y,"Population ages 30-34, female (% of female population)"
1045,SP.POP.3034.MA.5Y,"Population ages 30-34, male (% of male population)"
1046,SP.POP.3539.FE.5Y,"Population ages 35-39, female (% of female population)"
1047,SP.POP.3539.MA.5Y,"Population ages 35-39, male (% of male population)"
1048,SP.POP.4044.FE.5Y,"Population ages 40-44, female (% of female population)"
1049,SP.POP.4044.MA.5Y,"Population ages 40-44, male (% of male population)"
1050,SP.POP.4549.FE.5Y,"Population ages 45-49, female (% of female population)"
1051,SP.POP.4549.MA.5Y,"Population ages 45-49, male (% of male population)"
1052,SP.POP.5054.FE.5Y,"Population ages 50-54, female (% of female population)"
1053,SP.POP.5054.MA.5Y,"Population ages 50-54, male (% of male population)"
1054,SP.POP.5559.FE.5Y,"Population ages 55-59, female (% of female population)"
1055,SP.POP.5559.MA.5Y,"Population ages 55-59, male (% of male population)"
1056,SP.POP.6064.FE.5Y,"Population ages 60-64, female (% of female population)"
1057,SP.POP.6064.MA.5Y,"Population ages 60-64, male (% of male population)"
1058,SP.POP.65UP.TO.ZS,Population ages 65 and above (% of total population)
1059,SP.POP.65UP.FE.IN,"Population ages 65 and above, female"
1060,SP.POP.65UP.FE.ZS,"Population ages 65 and above, female (% of female population)"
1061,SP.POP.65UP.MA.IN,"Population ages 65 and above, male"
1062,SP.POP.65UP.MA.ZS,"Population ages 65 and above, male (% of male population)"
1063,SP.POP.65UP.TO,"Population ages 65 and above, total"
1064,SP.POP.6569.FE.5Y,"Population ages 65-69, female (% of female population)"
1065,SP.POP.6569.MA.5Y,"Population ages 65-69, male (% of male population)"
1066,SP.POP.7074.FE.5Y,"Population ages 70-74, female (% of female population)"
1067,SP.POP.7074.MA.5Y,"Population ages 70-74, male (% of male population)"
1068,SP.POP.7579.FE.5Y,"Population ages 75-79, female (% of female population)"
1069,SP.POP.7579.MA.5Y,"Population ages 75-79, male (% of male population)"
1070,SP.POP.80UP.FE.5Y,"Population ages 80 and above, female (% of female population)"
1071,SP.POP.80UP.MA.5Y,"Population ages 80 and above, male (% of male population)"
1072,EN.POP.DNST,Population density (people per sq. km of land area)
1073,SP.POP.GROW,Population growth (annual %)
1074,EN.URB.LCTY,Population in largest city
1075,EN.URB.LCTY.UR.ZS,Population in the largest city (% of urban population)
1076,EN.URB.MCTY,Population in urban agglomerations of more than 1 million
1077,EN.URB.MCTY.TL.ZS,Population in urban agglomerations of more than 1 million (% of total population)
1078,EN.POP.EL5M.ZS,Population living in areas where elevation is below 5 meters (% of total population)
1079,EN.POP.SLUM.UR.ZS,Population living in slums (% of urban population)
1080,SP.POP.TOTL.FE.IN,"Population, female"
1081,SP.POP.TOTL.FE.ZS,"Population, female (% of total population)"
1082,SP.POP.TOTL.MA.IN,"Population, male"
1083,SP.POP.TOTL.MA.ZS,"Population, male (% of total population)"
1084,SP.POP.TOTL,"Population, total"
1085,BX.PEF.TOTL.CD.WD,"Portfolio equity, net inflows (BoP, current US$)"
1086,DT.NFL.BOND.CD,"Portfolio investment, bonds (PPG + PNG) (NFL, current US$)"
1087,BN.KLT.PTXL.CD,"Portfolio investment, net (BoP, current US$)"
1088,SI.POV.GAPS,Poverty gap at $2.15 a day (2017 PPP) (%)
1089,SI.POV.LMIC.GP,Poverty gap at $3.65 a day (2017 PPP) (%)
1090,SI.POV.UMIC.GP,Poverty gap at $6.85 a day (2017 PPP) (%)
1091,SI.POV.DDAY,Poverty headcount ratio at $2.15 a day (2017 PPP) (% of population)
1092,SI.POV.LMIC,Poverty headcount ratio at $3.65 a day (2017 PPP) (% of population)
1093,SI.POV.UMIC,Poverty headcount ratio at $6.85 a day (2017 PPP) (% of population)
1094,SI.POV.NAHC,Poverty headcount ratio at national poverty lines (% of population)
1095,SI.POV.SOPO,Poverty headcount ratio at societal poverty line (% of population)
1096,IC.ELC.OUTG,Power outages in firms in a typical month (number)
1097,DT.NFL.PBND.CD,"PPG, bonds (NFL, current US$)"
1098,DT.NFL.PCBK.CD,"PPG, commercial banks (NFL, current US$)"
1099,DT.DOD.MIBR.CD,"PPG, IBRD (DOD, current US$)"
1100,DT.DOD.MIDA.CD,"PPG, IDA (DOD, current US$)"
1101,DT.NFL.OFFT.CD,"PPG, official creditors (NFL, US$)"
1102,DT.NFL.PROP.CD,"PPG, other private creditors (NFL, current US$)"
1103,DT.NFL.PRVT.CD,"PPG, private creditors (NFL, US$)"
1104,PA.NUS.PPP,"PPP conversion factor, GDP (LCU per international $)"
1105,PA.NUS.PRVT.PP,"PPP conversion factor, private consumption (LCU per international $)"
1106,SH.STA.ANVC.ZS,Pregnant women receiving prenatal care (%)
1107,SE.PRE.DURS,"Preprimary education, duration (years)"
1108,DT.DOD.PVLX.EX.ZS,"Present value of external debt (% of exports of goods, services and primary income)"
1109,DT.DOD.PVLX.GN.ZS,Present value of external debt (% of GNI)
1110,DT.DOD.PVLX.CD,Present value of external debt (current US$)
1111,SH.ANM.CHLD.ZS,Prevalence of anemia among children (% of children ages 6-59 months)
1112,SH.ANM.NPRG.ZS,Prevalence of anemia among non-pregnant women (% of women ages 15-49)
1113,SH.PRG.ANEM,Prevalence of anemia among pregnant women (%)
1114,SH.ANM.ALLW.ZS,Prevalence of anemia among women of reproductive age (% of women ages 15-49)
1115,SH.PRV.SMOK,Prevalence of current tobacco use (% of adults)
1116,SH.PRV.SMOK.FE,"Prevalence of current tobacco use, females (% of female adults)"
1117,SH.PRV.SMOK.MA,"Prevalence of current tobacco use, males (% of male adults)"
1118,SH.HIV.1524.FE.ZS,"Prevalence of HIV, female (% ages 15-24)"
1119,SH.HIV.1524.MA.ZS,"Prevalence of HIV, male (% ages 15-24)"
1120,SH.DYN.AIDS.ZS,"Prevalence of HIV, total (% of population ages 15-49)"
1121,SN.ITK.MSFI.ZS,Prevalence of moderate or severe food insecurity in the population (%)
1122,SH.STA.OWGH.ME.ZS,"Prevalence of overweight (modeled estimate, % of children under 5)"
1123,SH.STA.OWGH.ZS,"Prevalence of overweight, weight for height (% of children under 5)"
1124,SH.STA.OWGH.FE.ZS,"Prevalence of overweight, weight for height, female (% of children under 5)"
1125,SH.STA.OWGH.MA.ZS,"Prevalence of overweight, weight for height, male (% of children under 5)"
1126,SN.ITK.SVFI.ZS,Prevalence of severe food insecurity in the population (%)
1127,SH.SVR.WAST.ZS,"Prevalence of severe wasting, weight for height (% of children under 5)"
1128,SH.SVR.WAST.FE.ZS,"Prevalence of severe wasting, weight for height, female (% of children under 5)"
1129,SH.SVR.WAST.MA.ZS,"Prevalence of severe wasting, weight for height, male (% of children under 5)"
1130,SH.STA.STNT.ZS,"Prevalence of stunting, height for age (% of children under 5)"
1131,SH.STA.STNT.ME.ZS,"Prevalence of stunting, height for age (modeled estimate, % of children under 5)"
1132,SH.STA.STNT.FE.ZS,"Prevalence of stunting, height for age, female (% of children under 5)"
1133,SH.STA.STNT.MA.ZS,"Prevalence of stunting, height for age, male (% of children under 5)"
1134,SN.ITK.DEFC.ZS,Prevalence of undernourishment (% of population)
1135,SH.STA.MALN.ZS,"Prevalence of underweight, weight for age (% of children under 5)"
1136,SH.STA.MALN.FE.ZS,"Prevalence of underweight, weight for age, female (% of children under 5)"
1137,SH.STA.MALN.MA.ZS,"Prevalence of underweight, weight for age, male (% of children under 5)"
1138,SH.STA.WAST.ZS,"Prevalence of wasting, weight for height (% of children under 5)"
1139,SH.STA.WAST.FE.ZS,"Prevalence of wasting, weight for height, female (% of children under 5)"
1140,SH.STA.WAST.MA.ZS,"Prevalence of wasting, weight for height, male (% of children under 5)"
1141,PA.NUS.PPPC.RF,Price level ratio of PPP conversion factor (GDP) to market exchange rate
1142,SE.PRM.CMPT.FE.ZS,"Primary completion rate, female (% of relevant age group)"
1143,SE.PRM.CMPT.MA.ZS,"Primary completion rate, male (% of relevant age group)"
1144,SE.PRM.CMPT.ZS,"Primary completion rate, total (% of relevant age group)"
1145,SE.PRM.DURS,"Primary education, duration (years)"
1146,SE.PRM.ENRL,"Primary education, pupils"
1147,SE.PRM.ENRL.FE.ZS,"Primary education, pupils (% female)"
1148,SE.PRM.TCHR,"Primary education, teachers"
1149,SE.PRM.TCHR.FE.ZS,"Primary education, teachers (% female)"
1150,GF.XPD.BUDG.ZS,Primary government expenditures as a proportion of original approved budget (%)
1151,BM.GSR.FCTY.CD,"Primary income payments (BoP, current US$)"
1152,BX.GSR.FCTY.CD,"Primary income receipts (BoP, current US$)"
1153,SE.LPV.PRIM.SD,Primary school age children out-of-school (%)
1154,SE.PRM.AGES,Primary school starting age (years)
1155,IC.CRD.PRVT.ZS,Private credit bureau coverage (% of adults)
1156,SH.DYN.1014,"Probability of dying among adolescents ages 10-14 years (per 1,000)"
1157,SH.DYN.1519,"Probability of dying among adolescents ages 15-19 years (per 1,000)"
1158,SH.DYN.0509,"Probability of dying among children ages 5-9 years (per 1,000)"
1159,SH.DYN.2024,"Probability of dying among youth ages 20-24 years (per 1,000)"
1160,IC.WRH.PROC,Procedures to build a warehouse (number)
1161,IC.PRP.PROC,Procedures to register property (number)
1162,IC.TAX.PRFT.CP.ZS,Profit tax (% of commercial profits)
1163,SE.SEC.PROG.ZS,Progression to secondary school (%)
1164,SE.SEC.PROG.FE.ZS,"Progression to secondary school, female (%)"
1165,SE.SEC.PROG.MA.ZS,"Progression to secondary school, male (%)"
1166,SI.DST.50MD,Proportion of people living below 50 percent of median income (%)
1167,SH.UHC.NOP1.ZS,Proportion of population pushed below the $2.15 ($ 2017 PPP) poverty line by out-of-pocket health care expenditure (%)
1168,SH.UHC.NOP2.ZS,Proportion of population pushed below the $3.65 ($ 2017 PPP) poverty line by out-of-pocket health care expenditure (%)
1169,SH.UHC.NOPR.ZS,Proportion of population pushed below the 60% median consumption poverty line by out-of-pocket health expenditure (%)
1170,SH.UHC.FBP1.ZS,Proportion of population pushed further below the $2.15 ($ 2017 PPP) poverty line by out-of-pocket health care expenditure (%)
1171,SH.UHC.FBP2.ZS,Proportion of population pushed further below the $3.65 ($ 2017 PPP) poverty line by out-of-pocket health care expenditure (%)
1172,SH.UHC.FBPR.ZS,Proportion of population pushed further below the 60% median consumption poverty line by out-of-pocket health care expenditure (%)
1173,SH.UHC.TOT1.ZS,Proportion of population pushed or further pushed below the $2.15 ($ 2017 PPP) poverty line by out-of-pocket health care expenditure (%)
1174,SH.UHC.TOT2.ZS,Proportion of population pushed or further pushed below the $3.65 ($ 2017 PPP) poverty line by out-of-pocket health care expenditure (%)
1175,SH.UHC.TOTR.ZS,Proportion of population pushed or further pushed below the 60% median consumption poverty line by out-of-pocket health expenditure (%)
1176,SH.UHC.OOPC.10.ZS,Proportion of population spending more than 10% of household consumption or income on out-of-pocket health care expenditure (%)
1177,SH.UHC.OOPC.25.ZS,Proportion of population spending more than 25% of household consumption or income on out-of-pocket health care expenditure (%)
1178,SG.GEN.PARL.ZS,Proportion of seats held by women in national parliaments (%)
1179,SG.TIM.UWRK.FE,"Proportion of time spent on unpaid domestic and care work, female (% of 24 hour day)"
1180,SG.TIM.UWRK.MA,"Proportion of time spent on unpaid domestic and care work, male (% of 24 hour day)"
1181,SG.VAW.1549.ZS,Proportion of women subjected to physical and/or sexual violence in the last 12 months (% of ever-partnered women ages 15-49)
1182,DT.TDS.DPPG.XP.ZS,"Public and publicly guaranteed debt service (% of exports of goods, services and primary income)"
1183,DT.TDS.DPPG.GN.ZS,Public and publicly guaranteed debt service (% of GNI)
1184,IC.CRD.PUBL.ZS,Public credit registry coverage (% of adults)
1185,IE.PPN.ENGY.CD,Public private partnerships investment in energy (current US$)
1186,IE.PPN.ICTI.CD,Public private partnerships investment in ICT (current US$)
1187,IE.PPN.TRAN.CD,Public private partnerships investment in transport (current US$)
1188,IE.PPN.WATR.CD,Public private partnerships investment in water and sanitation (current US$)
1189,EP.PMP.DESL.CD,Pump price for diesel fuel (US$ per liter)
1190,EP.PMP.SGAS.CD,Pump price for gasoline (US$ per liter)
1191,SE.LPV.PRIM.LD,Pupils below minimum reading proficiency at end of primary (%). Low GAML threshold
1192,SE.SEC.ENRL.LO.TC.ZS,"Pupil-teacher ratio, lower secondary"
1193,SE.PRE.ENRL.TC.ZS,"Pupil-teacher ratio, preprimary"
1194,SE.PRM.ENRL.TC.ZS,"Pupil-teacher ratio, primary"
1195,SE.SEC.ENRL.TC.ZS,"Pupil-teacher ratio, secondary"
1196,SE.TER.ENRL.TC.ZS,"Pupil-teacher ratio, tertiary"
1197,SE.SEC.ENRL.UP.TC.ZS,"Pupil-teacher ratio, upper secondary"
1198,IS.RRS.TOTL.KM,Rail lines (total route-km)
1199,IS.RRS.GOOD.MT.K6,"Railways, goods transported (million ton-km)"
1200,IS.RRS.PASG.KM,"Railways, passengers carried (million passenger-km)"
1201,SL.TLF.CACT.FM.ZS,Ratio of female to male labor force participation rate (%) (modeled ILO estimate)
1202,SL.TLF.CACT.FM.NE.ZS,Ratio of female to male labor force participation rate (%) (national estimate)
1203,PX.REX.REER,Real effective exchange rate index (2010 = 100)
1204,FR.INR.RINR,Real interest rate (%)
1205,SM.POP.REFG,Refugee population by country or territory of asylum
1206,SM.POP.REFG.OR,Refugee population by country or territory of origin
1207,RQ.EST,Regulatory Quality: Estimate
1208,RQ.NO.SRC,Regulatory Quality: Number of Sources
1209,RQ.PER.RNK,Regulatory Quality: Percentile Rank
1210,RQ.PER.RNK.LOWER,"Regulatory Quality: Percentile Rank, Lower Bound of 90% Confidence Interval"
1211,RQ.PER.RNK.UPPER,"Regulatory Quality: Percentile Rank, Upper Bound of 90% Confidence Interval"
1212,RQ.STD.ERR,Regulatory Quality: Standard Error
1213,EG.ELC.RNEW.ZS,Renewable electricity output (% of total electricity output)
1214,EG.FEC.RNEW.ZS,Renewable energy consumption (% of total final energy consumption)
1215,ER.H2O.INTR.PC,Renewable internal freshwater resources per capita (cubic meters)
1216,ER.H2O.INTR.K3,"Renewable internal freshwater resources, total (billion cubic meters)"
1217,SE.PRM.REPT.FE.ZS,"Repeaters, primary, female (% of female enrollment)"
1218,SE.PRM.REPT.MA.ZS,"Repeaters, primary, male (% of male enrollment)"
1219,SE.PRM.REPT.ZS,"Repeaters, primary, total (% of total enrollment)"
1220,GB.XPD.RSDV.GD.ZS,Research and development expenditure (% of GDP)
1221,SP.POP.SCIE.RD.P6,Researchers in R&D (per million people)
1222,BN.RES.INCL.CD,"Reserves and related items (BoP, current US$)"
1223,GC.REV.XGRT.GD.ZS,"Revenue, excluding grants (% of GDP)"
1224,GC.REV.XGRT.CN,"Revenue, excluding grants (current LCU)"
1225,SH.SGR.CRSK.ZS,Risk of catastrophic expenditure for surgical care (% of people at risk)
1226,SH.SGR.IRSK.ZS,Risk of impoverishing expenditure for surgical care (% of people at risk)
1227,FR.INR.RISK,"Risk premium on lending (lending rate minus treasury bill rate, %)"
1228,RL.EST,Rule of Law: Estimate
1229,RL.NO.SRC,Rule of Law: Number of Sources
1230,RL.PER.RNK,Rule of Law: Percentile Rank
1231,RL.PER.RNK.LOWER,"Rule of Law: Percentile Rank, Lower Bound of 90% Confidence Interval"
1232,RL.PER.RNK.UPPER,"Rule of Law: Percentile Rank, Upper Bound of 90% Confidence Interval"
1233,RL.STD.ERR,Rule of Law: Standard Error
1234,AG.LND.TOTL.RU.K2,Rural land area (sq. km)
1235,AG.LND.EL5M.RU.ZS,Rural land area where elevation is below 5 meters (% of total land area)
1236,AG.LND.EL5M.RU.K2,Rural land area where elevation is below 5 meters (sq. km)
1237,SP.RUR.TOTL,Rural population
1238,SP.RUR.TOTL.ZS,Rural population (% of total population)
1239,SP.RUR.TOTL.ZG,Rural population growth (annual %)
1240,EN.POP.EL5M.RU.ZS,Rural population living in areas where elevation is below 5 meters (% of total population)
1241,CM.MKT.INDX.ZG,S&P Global Equity Indices (annual % change)
1242,SE.PRE.ENRR,"School enrollment, preprimary (% gross)"
1243,SE.PRE.ENRR.FE,"School enrollment, preprimary, female (% gross)"
1244,SE.PRE.ENRR.MA,"School enrollment, preprimary, male (% gross)"
1245,SE.PRM.ENRR,"School enrollment, primary (% gross)"
1246,SE.PRM.NENR,"School enrollment, primary (% net)"
1247,SE.ENR.PRIM.FM.ZS,"School enrollment, primary (gross), gender parity index (GPI)"
1248,SE.ENR.PRSC.FM.ZS,"School enrollment, primary and secondary (gross), gender parity index (GPI)"
1249,SE.PRM.ENRR.FE,"School enrollment, primary, female (% gross)"
1250,SE.PRM.NENR.FE,"School enrollment, primary, female (% net)"
1251,SE.PRM.ENRR.MA,"School enrollment, primary, male (% gross)"
1252,SE.PRM.NENR.MA,"School enrollment, primary, male (% net)"
1253,SE.PRM.PRIV.ZS,"School enrollment, primary, private (% of total primary)"
1254,SE.SEC.ENRR,"School enrollment, secondary (% gross)"
1255,SE.SEC.NENR,"School enrollment, secondary (% net)"
1256,SE.ENR.SECO.FM.ZS,"School enrollment, secondary (gross), gender parity index (GPI)"
1257,SE.SEC.ENRR.FE,"School enrollment, secondary, female (% gross)"
1258,SE.SEC.NENR.FE,"School enrollment, secondary, female (% net)"
1259,SE.SEC.ENRR.MA,"School enrollment, secondary, male (% gross)"
1260,SE.SEC.NENR.MA,"School enrollment, secondary, male (% net)"
1261,SE.SEC.PRIV.ZS,"School enrollment, secondary, private (% of total secondary)"
1262,SE.TER.ENRR,"School enrollment, tertiary (% gross)"
1263,SE.ENR.TERT.FM.ZS,"School enrollment, tertiary (gross), gender parity index (GPI)"
1264,SE.TER.ENRR.FE,"School enrollment, tertiary, female (% gross)"
1265,SE.TER.ENRR.MA,"School enrollment, tertiary, male (% gross)"
1266,IP.JRN.ARTC.SC,Scientific and technical journal articles
1267,SE.SEC.DURS,"Secondary education, duration (years)"
1268,SE.SEC.ENRL.GC,"Secondary education, general pupils"
1269,SE.SEC.ENRL.GC.FE.ZS,"Secondary education, general pupils (% female)"
1270,SE.SEC.ENRL,"Secondary education, pupils"
1271,SE.SEC.ENRL.FE.ZS,"Secondary education, pupils (% female)"
1272,SE.SEC.TCHR,"Secondary education, teachers"
1273,SE.SEC.TCHR.FE.ZS,"Secondary education, teachers (% female)"
1274,SE.SEC.TCHR.FE,"Secondary education, teachers, female"
1275,SE.SEC.ENRL.VO,"Secondary education, vocational pupils"
1276,SE.SEC.ENRL.VO.FE.ZS,"Secondary education, vocational pupils (% female)"
1277,BX.TRF.CURR.CD,"Secondary income receipts (BoP, current US$)"
1278,BM.TRF.PRVT.CD,"Secondary income, other sectors, payments (BoP, current US$)"
1279,IT.NET.SECR,Secure Internet servers
1280,IT.NET.SECR.P6,Secure Internet servers (per 1 million people)
