,Series Code,Series Name
0,EG.CFT.ACCS.ZS,Access to clean fuels and technologies for cooking (% of population)
1,EG.CFT.ACCS.RU.ZS,"Access to clean fuels and technologies for cooking, rural (% of rural population)"
2,EG.CFT.ACCS.UR.ZS,"Access to clean fuels and technologies for cooking, urban (% of urban population)"
3,EG.ELC.ACCS.ZS,Access to electricity (% of population)
4,EG.ELC.ACCS.RU.ZS,"Access to electricity, rural (% of rural population)"
5,EG.ELC.ACCS.UR.ZS,"Access to electricity, urban (% of urban population)"
6,FX.OWN.TOTL.ZS,Account ownership at a financial institution or with a mobile-money-service provider (% of population ages 15+)
7,FX.OWN.TOTL.FE.ZS,"Account ownership at a financial institution or with a mobile-money-service provider, female (% of population ages 15+)"
8,FX.OWN.TOTL.MA.ZS,"Account ownership at a financial institution or with a mobile-money-service provider, male (% of population ages 15+)"
9,FX.OWN.TOTL.OL.ZS,"Account ownership at a financial institution or with a mobile-money-service provider, older adults (% of population ages 25+)"
10,FX.OWN.TOTL.40.ZS,"Account ownership at a financial institution or with a mobile-money-service provider, poorest 40% (% of population ages 15+)"
11,FX.OWN.TOTL.PL.ZS,"Account ownership at a financial institution or with a mobile-money-service provider, primary education or less (% of population ages 15+)"
12,FX.OWN.TOTL.60.ZS,"Account ownership at a financial institution or with a mobile-money-service provider, richest 60% (% of population ages 15+)"
13,FX.OWN.TOTL.SO.ZS,"Account ownership at a financial institution or with a mobile-money-service provider, secondary education or more (% of population ages 15+)"
14,FX.OWN.TOTL.YG.ZS,"Account ownership at a financial institution or with a mobile-money-service provider, young adults (% of population ages 15-24)"
15,per_si_allsi.adq_pop_tot,Adequacy of social insurance programs (% of total welfare of beneficiary households)
16,per_allsp.adq_pop_tot,Adequacy of social protection and labor programs (% of total welfare of beneficiary households)
17,per_sa_allsa.adq_pop_tot,Adequacy of social safety net programs (% of total welfare of beneficiary households)
18,per_lm_alllm.adq_pop_tot,Adequacy of unemployment benefits and ALMP (% of total welfare of beneficiary households)
19,SE.PRM.TENR,"Adjusted net enrollment rate, primary (% of primary school age children)"
20,SE.PRM.TENR.FE,"Adjusted net enrollment rate, primary, female (% of primary school age children)"
21,SE.PRM.TENR.MA,"Adjusted net enrollment rate, primary, male (% of primary school age children)"
22,NY.ADJ.NNTY.KD.ZG,Adjusted net national income (annual % growth)
23,NY.ADJ.NNTY.KD,Adjusted net national income (constant 2015 US$)
24,NY.ADJ.NNTY.CD,Adjusted net national income (current US$)
25,NY.ADJ.NNTY.PC.KD.ZG,Adjusted net national income per capita (annual % growth)
26,NY.ADJ.NNTY.PC.KD,Adjusted net national income per capita (constant 2015 US$)
27,NY.ADJ.NNTY.PC.CD,Adjusted net national income per capita (current US$)
28,NY.ADJ.SVNX.GN.ZS,"Adjusted net savings, excluding particulate emission damage (% of GNI)"
29,NY.ADJ.SVNX.CD,"Adjusted net savings, excluding particulate emission damage (current US$)"
30,NY.ADJ.SVNG.GN.ZS,"Adjusted net savings, including particulate emission damage (% of GNI)"
31,NY.ADJ.SVNG.CD,"Adjusted net savings, including particulate emission damage (current US$)"
32,NY.ADJ.DCO2.GN.ZS,Adjusted savings: carbon dioxide damage (% of GNI)
33,NY.ADJ.DCO2.CD,Adjusted savings: carbon dioxide damage (current US$)
34,NY.ADJ.DKAP.GN.ZS,Adjusted savings: consumption of fixed capital (% of GNI)
35,NY.ADJ.DKAP.CD,Adjusted savings: consumption of fixed capital (current US$)
36,NY.ADJ.AEDU.GN.ZS,Adjusted savings: education expenditure (% of GNI)
37,NY.ADJ.AEDU.CD,Adjusted savings: education expenditure (current US$)
38,NY.ADJ.DNGY.GN.ZS,Adjusted savings: energy depletion (% of GNI)
39,NY.ADJ.DNGY.CD,Adjusted savings: energy depletion (current US$)
40,NY.ADJ.ICTR.GN.ZS,Adjusted savings: gross savings (% of GNI)
41,NY.ADJ.DMIN.GN.ZS,Adjusted savings: mineral depletion (% of GNI)
42,NY.ADJ.DMIN.CD,Adjusted savings: mineral depletion (current US$)
43,NY.ADJ.DRES.GN.ZS,Adjusted savings: natural resources depletion (% of GNI)
44,NY.ADJ.DFOR.GN.ZS,Adjusted savings: net forest depletion (% of GNI)
45,NY.ADJ.DFOR.CD,Adjusted savings: net forest depletion (current US$)
46,NY.ADJ.NNAT.GN.ZS,Adjusted savings: net national savings (% of GNI)
47,NY.ADJ.NNAT.CD,Adjusted savings: net national savings (current US$)
48,NY.ADJ.DPEM.GN.ZS,Adjusted savings: particulate emission damage (% of GNI)
49,NY.ADJ.DPEM.CD,Adjusted savings: particulate emission damage (current US$)
50,SP.ADO.TFRT,"Adolescent fertility rate (births per 1,000 women ages 15-19)"
51,SE.SEC.UNER.LO.ZS,Adolescents out of school (% of lower secondary school age)
52,SE.SEC.UNER.LO.FE.ZS,"Adolescents out of school, female (% of female lower secondary school age)"
53,SE.SEC.UNER.LO.MA.ZS,"Adolescents out of school, male (% of male lower secondary school age)"
54,SH.HIV.INCD.TL,Adults (ages 15+) and children (ages 0-14) newly infected with HIV
55,SH.HIV.INCD,Adults (ages 15-49) newly infected with HIV
56,SP.POP.DPND,Age dependency ratio (% of working-age population)
57,SP.POP.DPND.OL,"Age dependency ratio, old (% of working-age population)"
58,SP.POP.DPND.YG,"Age dependency ratio, young (% of working-age population)"
59,AG.LND.IRIG.AG.ZS,Agricultural irrigated land (% of total agricultural land)
60,AG.LND.AGRI.ZS,Agricultural land (% of land area)
61,AG.LND.AGRI.K2,Agricultural land (sq. km)
62,AG.AGR.TRAC.NO,"Agricultural machinery, tractors"
63,AG.LND.TRAC.ZS,"Agricultural machinery, tractors per 100 sq. km of arable land"
64,EN.ATM.METH.AG.ZS,Agricultural methane emissions (% of total)
65,EN.ATM.METH.AG.KT.CE,Agricultural methane emissions (thousand metric tons of CO2 equivalent)
66,EN.ATM.NOXE.AG.ZS,Agricultural nitrous oxide emissions (% of total)
67,EN.ATM.NOXE.AG.KT.CE,Agricultural nitrous oxide emissions (thousand metric tons of CO2 equivalent)
68,TX.VAL.AGRI.ZS.UN,Agricultural raw materials exports (% of merchandise exports)
69,TM.VAL.AGRI.ZS.UN,Agricultural raw materials imports (% of merchandise imports)
70,NV.AGR.TOTL.ZS,"Agriculture, forestry, and fishing, value added (% of GDP)"
71,NV.AGR.TOTL.KD.ZG,"Agriculture, forestry, and fishing, value added (annual % growth)"
72,NV.AGR.TOTL.KD,"Agriculture, forestry, and fishing, value added (constant 2015 US$)"
73,NV.AGR.TOTL.KN,"Agriculture, forestry, and fishing, value added (constant LCU)"
74,NV.AGR.TOTL.CN,"Agriculture, forestry, and fishing, value added (current LCU)"
75,NV.AGR.TOTL.CD,"Agriculture, forestry, and fishing, value added (current US$)"
76,NV.AGR.EMPL.KD,"Agriculture, forestry, and fishing, value added per worker (constant 2015 US$)"
77,IS.AIR.GOOD.MT.K1,"Air transport, freight (million ton-km)"
78,IS.AIR.PSGR,"Air transport, passengers carried"
79,IS.AIR.DPRT,"Air transport, registered carrier departures worldwide"
80,EG.USE.COMM.CL.ZS,Alternative and nuclear energy (% of total energy use)
81,ER.H2O.FWAG.ZS,"Annual freshwater withdrawals, agriculture (% of total freshwater withdrawal)"
82,ER.H2O.FWDM.ZS,"Annual freshwater withdrawals, domestic (% of total freshwater withdrawal)"
83,ER.H2O.FWIN.ZS,"Annual freshwater withdrawals, industry (% of total freshwater withdrawal)"
84,ER.H2O.FWTL.ZS,"Annual freshwater withdrawals, total (% of internal resources)"
85,ER.H2O.FWTL.K3,"Annual freshwater withdrawals, total (billion cubic meters)"
86,SI.SPR.PC40.ZG,"Annualized average growth rate in per capita real survey mean consumption or income, bottom 40% of population (%)"
87,SI.SPR.PCAP.ZG,"Annualized average growth rate in per capita real survey mean consumption or income, total population (%)"
88,SH.HIV.ARTC.ZS,Antiretroviral therapy coverage (% of people living with HIV)
89,SH.HIV.PMTC.ZS,Antiretroviral therapy coverage for PMTCT (% of pregnant women living with HIV)
90,ER.FSH.AQUA.MT,Aquaculture production (metric tons)
91,AG.LND.ARBL.ZS,Arable land (% of land area)
92,AG.LND.ARBL.HA.PC,Arable land (hectares per person)
93,AG.LND.ARBL.HA,Arable land (hectares)
94,SH.STA.ARIC.ZS,ARI treatment (% of children under 5 taken to a health provider)
95,MS.MIL.TOTL.TF.ZS,Armed forces personnel (% of total labor force)
96,MS.MIL.TOTL.P1,"Armed forces personnel, total"
97,MS.MIL.XPRT.KD,Arms exports (SIPRI trend indicator values)
98,MS.MIL.MPRT.KD,Arms imports (SIPRI trend indicator values)
99,FB.ATM.TOTL.P5,"Automated teller machines (ATMs) (per 100,000 adults)"
100,AG.LND.PRCP.MM,Average precipitation in depth (mm per year)
101,IC.CUS.DURS.EX,Average time to clear exports through customs (days)
102,SI.RMT.COST.OB.ZS,Average transaction cost of sending remittances from a specific country (%)
103,SI.RMT.COST.IB.ZS,Average transaction cost of sending remittances to a specific country (%)
104,SL.TLF.0714.SW.TM,"Average working hours of children, study and work, ages 7-14 (hours per week)"
105,SL.TLF.0714.SW.FE.TM,"Average working hours of children, study and work, female, ages 7-14 (hours per week)"
106,SL.TLF.0714.SW.MA.TM,"Average working hours of children, study and work, male, ages 7-14 (hours per week)"
107,SL.TLF.0714.WK.TM,"Average working hours of children, working only, ages 7-14 (hours per week)"
108,SL.TLF.0714.WK.FE.TM,"Average working hours of children, working only, female, ages 7-14 (hours per week)"
109,SL.TLF.0714.WK.MA.TM,"Average working hours of children, working only, male, ages 7-14 (hours per week)"
110,FB.BNK.CAPA.ZS,Bank capital to assets ratio (%)
111,FD.RES.LIQU.AS.ZS,Bank liquid reserves to bank assets ratio (%)
112,FB.AST.NPER.ZS,Bank nonperforming loans to total gross loans (%)
113,VC.BTL.DETH,Battle-related deaths (number of people)
114,per_si_allsi.ben_q1_tot,Benefit incidence of social insurance programs to poorest quintile (% of total social insurance benefits)
115,per_allsp.ben_q1_tot,Benefit incidence of social protection and labor programs to poorest quintile (% of total SPL benefits)
116,per_sa_allsa.ben_q1_tot,Benefit incidence of social safety net programs to poorest quintile (% of total safety net benefits)
117,per_lm_alllm.ben_q1_tot,Benefit incidence of unemployment benefits and ALMP to poorest quintile (% of total U/ALMP benefits)
118,TM.TAX.MRCH.BC.ZS,"Binding coverage, all products (%)"
119,TM.TAX.MANF.BC.ZS,"Binding coverage, manufactured products (%)"
120,TM.TAX.TCOM.BC.ZS,"Binding coverage, primary products (%)"
121,EN.BIR.THRD.NO,"Bird species, threatened"
122,SP.DYN.CBRT.IN,"Birth rate, crude (per 1,000 people)"
123,SH.STA.BRTC.ZS,Births attended by skilled health staff (% of total)
124,FB.CBK.BRWR.P3,"Borrowers from commercial banks (per 1,000 adults)"
125,TM.TAX.MRCH.BR.ZS,"Bound rate, simple mean, all products (%)"
126,TM.TAX.MANF.BR.ZS,"Bound rate, simple mean, manufactured products (%)"
127,TM.TAX.TCOM.BR.ZS,"Bound rate, simple mean, primary products (%)"
128,IC.FRM.BRIB.ZS,Bribery incidence (% of firms experiencing at least one bribe payment request)
129,FM.LBL.BMNY.GD.ZS,Broad money (% of GDP)
130,FM.LBL.BMNY.CN,Broad money (current LCU)
131,FM.LBL.BMNY.ZG,Broad money growth (annual %)
132,FM.LBL.BMNY.IR.ZS,Broad money to total reserves ratio
133,IC.BUS.DISC.XQ,Business extent of disclosure index (0=less disclosure to 10=more disclosure)
134,ER.FSH.CAPT.MT,Capture fisheries production (metric tons)
135,SH.DTH.COMM.ZS,"Cause of death, by communicable diseases and maternal, prenatal and nutrition conditions (% of total)"
136,SH.DTH.INJR.ZS,"Cause of death, by injury (% of total)"
137,SH.DTH.NCOM.ZS,"Cause of death, by non-communicable diseases (% of total)"
138,GC.DOD.TOTL.GD.ZS,"Central government debt, total (% of GDP)"
139,GC.DOD.TOTL.CN,"Central government debt, total (current LCU)"
140,AG.PRD.CREL.MT,Cereal production (metric tons)
141,AG.YLD.CREL.KG,Cereal yield (kg per hectare)
142,NE.GDI.STKB.KN,Changes in inventories (constant LCU)
143,NE.GDI.STKB.CN,Changes in inventories (current LCU)
144,NE.GDI.STKB.CD,Changes in inventories (current US$)
145,BM.GSR.ROYL.CD,"Charges for the use of intellectual property, payments (BoP, current US$)"
146,BX.GSR.ROYL.CD,"Charges for the use of intellectual property, receipts (BoP, current US$)"
147,NV.MNF.CHEM.ZS.UN,Chemicals (% of value added in manufacturing)
148,SL.AGR.0714.ZS,Child employment in agriculture (% of economically active children ages 7-14)
149,SL.AGR.0714.FE.ZS,"Child employment in agriculture, female (% of female economically active children ages 7-14)"
150,SL.AGR.0714.MA.ZS,"Child employment in agriculture, male (% of male economically active children ages 7-14)"
151,SL.MNF.0714.ZS,Child employment in manufacturing (% of economically active children ages 7-14)
152,SL.MNF.0714.FE.ZS,"Child employment in manufacturing, female (% of female economically active children ages 7-14)"
153,SL.MNF.0714.MA.ZS,"Child employment in manufacturing, male (% of male economically active children ages 7-14)"
154,SL.SRV.0714.ZS,Child employment in services (% of economically active children ages 7-14)
155,SL.SRV.0714.FE.ZS,"Child employment in services, female (% of female economically active children ages 7-14)"
156,SL.SRV.0714.MA.ZS,"Child employment in services, male (% of male economically active children ages 7-14)"
157,SH.HIV.0014,Children (0-14) living with HIV
158,SH.HIV.INCD.14,Children (ages 0-14) newly infected with HIV
159,SL.TLF.0714.FE.ZS,"Children in employment, female (% of female children ages 7-14)"
160,SL.TLF.0714.MA.ZS,"Children in employment, male (% of male children ages 7-14)"
161,SL.SLF.0714.ZS,"Children in employment, self-employed (% of children in employment, ages 7-14)"
162,SL.SLF.0714.FE.ZS,"Children in employment, self-employed, female (% of female children in employment, ages 7-14)"
163,SL.SLF.0714.MA.ZS,"Children in employment, self-employed, male (% of male children in employment, ages 7-14)"
164,SL.TLF.0714.SW.ZS,"Children in employment, study and work (% of children in employment, ages 7-14)"
165,SL.TLF.0714.SW.FE.ZS,"Children in employment, study and work, female (% of female children in employment, ages 7-14)"
166,SL.TLF.0714.SW.MA.ZS,"Children in employment, study and work, male (% of male children in employment, ages 7-14)"
167,SL.TLF.0714.ZS,"Children in employment, total (% of children ages 7-14)"
168,SL.FAM.0714.ZS,"Children in employment, unpaid family workers (% of children in employment, ages 7-14)"
169,SL.FAM.0714.FE.ZS,"Children in employment, unpaid family workers, female (% of female children in employment, ages 7-14)"
170,SL.FAM.0714.MA.ZS,"Children in employment, unpaid family workers, male (% of male children in employment, ages 7-14)"
171,SL.WAG.0714.ZS,"Children in employment, wage workers (% of children in employment, ages 7-14)"
172,SL.WAG.0714.FE.ZS,"Children in employment, wage workers, female (% of female children in employment, ages 7-14)"
173,SL.WAG.0714.MA.ZS,"Children in employment, wage workers, male (% of male children in employment, ages 7-14)"
174,SL.TLF.0714.WK.ZS,"Children in employment, work only (% of children in employment, ages 7-14)"
175,SL.TLF.0714.WK.FE.ZS,"Children in employment, work only, female (% of female children in employment, ages 7-14)"
176,SL.TLF.0714.WK.MA.ZS,"Children in employment, work only, male (% of male children in employment, ages 7-14)"
177,SE.PRM.UNER.ZS,Children out of school (% of primary school age)
178,SE.PRM.UNER.FE.ZS,"Children out of school, female (% of female primary school age)"
179,SE.PRM.UNER.MA.ZS,"Children out of school, male (% of male primary school age)"
180,SE.PRM.UNER,"Children out of school, primary"
181,SE.PRM.UNER.FE,"Children out of school, primary, female"
182,SE.PRM.UNER.MA,"Children out of school, primary, male"
183,SH.MLR.TRET.ZS,Children with fever receiving antimalarial drugs (% of children under age 5 with fever)
184,FM.AST.CGOV.ZG.M3,Claims on central government (annual growth as % of broad money)
185,FS.AST.CGOV.GD.ZS,"Claims on central government, etc. (% GDP)"
186,FS.AST.DOMO.GD.ZS,Claims on other sectors of the domestic economy (% of GDP)
187,FM.AST.DOMO.ZG.M3,Claims on other sectors of the domestic economy (annual growth as % of broad money)
188,FM.AST.PRVT.ZG.M3,Claims on private sector (annual growth as % of broad money)
189,EN.ATM.CO2E.KD.GD,CO2 emissions (kg per 2015 US$ of GDP)
190,EN.ATM.CO2E.PP.GD.KD,CO2 emissions (kg per 2021 PPP $ of GDP)
191,EN.ATM.CO2E.PP.GD,CO2 emissions (kg per PPP $ of GDP)
192,EN.ATM.CO2E.KT,CO2 emissions (kt)
193,EN.ATM.CO2E.PC,CO2 emissions (metric tons per capita)
194,EN.CO2.ETOT.ZS,"CO2 emissions from electricity and heat production, total (% of total fuel combustion)"
195,EN.ATM.CO2E.GF.ZS,CO2 emissions from gaseous fuel consumption (% of total)
196,EN.ATM.CO2E.GF.KT,CO2 emissions from gaseous fuel consumption (kt)
197,EN.ATM.CO2E.LF.ZS,CO2 emissions from liquid fuel consumption (% of total)
198,EN.ATM.CO2E.LF.KT,CO2 emissions from liquid fuel consumption (kt)
199,EN.CO2.MANF.ZS,CO2 emissions from manufacturing industries and construction (% of total fuel combustion)
200,EN.CO2.OTHX.ZS,"CO2 emissions from other sectors, excluding residential buildings and commercial and public services (% of total fuel combustion)"
201,EN.CO2.BLDG.ZS,CO2 emissions from residential buildings and commercial and public services (% of total fuel combustion)
202,EN.ATM.CO2E.SF.ZS,CO2 emissions from solid fuel consumption (% of total)
203,EN.ATM.CO2E.SF.KT,CO2 emissions from solid fuel consumption (kt)
204,EN.CO2.TRAN.ZS,CO2 emissions from transport (% of total fuel combustion)
205,EN.ATM.CO2E.EG.ZS,CO2 intensity (kg per kg of oil equivalent energy use)
206,NY.GDP.COAL.RT.ZS,Coal rents (% of GDP)
207,EG.USE.CRNW.ZS,Combustible renewables and waste (% of total energy)
208,FB.CBK.BRCH.P5,"Commercial bank branches (per 100,000 adults)"
209,DT.NFL.PCBO.CD,"Commercial banks and other lending (PPG + PNG) (NFL, current US$)"
210,TX.VAL.SERV.CD.WT,Commercial service exports (current US$)
211,TM.VAL.SERV.CD.WT,Commercial service imports (current US$)
212,BX.GSR.CMCP.ZS,"Communications, computer, etc. (% of service exports, BoP)"
213,BM.GSR.CMCP.ZS,"Communications, computer, etc. (% of service imports, BoP)"
214,SH.MED.CMHW.P3,"Community health workers (per 1,000 people)"
215,GC.XPN.COMP.ZS,Compensation of employees (% of expense)
216,GC.XPN.COMP.CN,Compensation of employees (current LCU)
217,SP.REG.BRTH.ZS,Completeness of birth registration (%)
218,SP.REG.BRTH.FE.ZS,"Completeness of birth registration, female (%)"
219,SP.REG.BRTH.MA.ZS,"Completeness of birth registration, male (%)"
220,SP.REG.BRTH.RU.ZS,"Completeness of birth registration, rural (%)"
221,SP.REG.BRTH.UR.ZS,"Completeness of birth registration, urban (%)"
222,SP.REG.DTHS.ZS,Completeness of death registration with cause-of-death information (%)
223,SE.COM.DURS,"Compulsory education, duration (years)"
224,TX.VAL.OTHR.ZS.WT,"Computer, communications and other services (% of commercial service exports)"
225,TM.VAL.OTHR.ZS.WT,"Computer, communications and other services (% of commercial service imports)"
226,SH.CON.1524.FE.ZS,"Condom use, population ages 15-24, female (% of females ages 15-24)"
227,SH.CON.1524.MA.ZS,"Condom use, population ages 15-24, male (% of males ages 15-24)"
228,FP.CPI.TOTL,Consumer price index (2010 = 100)
229,SN.ITK.SALT.ZS,Consumption of iodized salt (% of households)
230,IS.SHP.GOOD.TU,Container port traffic (TEU: 20 foot equivalent units)
231,SP.DYN.CONU.ZS,"Contraceptive prevalence, any method (% of married women ages 15-49)"
232,SP.DYN.CONM.ZS,"Contraceptive prevalence, any modern method (% of married women ages 15-49)"
233,SL.FAM.WORK.FE.ZS,"Contributing family workers, female (% of female employment) (modeled ILO estimate)"
234,SL.FAM.WORK.MA.ZS,"Contributing family workers, male (% of male employment) (modeled ILO estimate)"
235,SL.FAM.WORK.ZS,"Contributing family workers, total (% of total employment) (modeled ILO estimate)"
236,CC.EST,Control of Corruption: Estimate
237,CC.NO.SRC,Control of Corruption: Number of Sources
238,CC.PER.RNK,Control of Corruption: Percentile Rank
239,CC.PER.RNK.LOWER,"Control of Corruption: Percentile Rank, Lower Bound of 90% Confidence Interval"
240,CC.PER.RNK.UPPER,"Control of Corruption: Percentile Rank, Upper Bound of 90% Confidence Interval"
241,CC.STD.ERR,Control of Corruption: Standard Error
242,IC.REG.COST.PC.ZS,Cost of business start-up procedures (% of GNI per capita)
243,IC.REG.COST.PC.FE.ZS,"Cost of business start-up procedures, female (% of GNI per capita)"
244,IC.REG.COST.PC.MA.ZS,"Cost of business start-up procedures, male (% of GNI per capita)"
245,IC.EXP.CSBC.CD,"Cost to export, border compliance (US$)"
246,IC.EXP.CSDC.CD,"Cost to export, documentary compliance (US$)"
247,IC.IMP.CSBC.CD,"Cost to import, border compliance (US$)"
248,IC.IMP.CSDC.CD,"Cost to import, documentary compliance (US$)"
249,per_si_allsi.cov_pop_tot,Coverage of social insurance programs (% of population)
250,per_si_allsi.cov_q2_tot,Coverage of social insurance programs in 2nd quintile (% of population)
251,per_si_allsi.cov_q3_tot,Coverage of social insurance programs in 3rd quintile (% of population)
252,per_si_allsi.cov_q4_tot,Coverage of social insurance programs in 4th quintile (% of population)
253,per_si_allsi.cov_q1_tot,Coverage of social insurance programs in poorest quintile (% of population)
254,per_si_allsi.cov_q5_tot,Coverage of social insurance programs in richest quintile (% of population)
255,per_allsp.cov_pop_tot,Coverage of social protection and labor programs (% of population)
256,per_sa_allsa.cov_pop_tot,Coverage of social safety net programs (% of population)
257,per_sa_allsa.cov_q2_tot,Coverage of social safety net programs in 2nd quintile (% of population)
258,per_sa_allsa.cov_q3_tot,Coverage of social safety net programs in 3rd quintile (% of population)
259,per_sa_allsa.cov_q4_tot,Coverage of social safety net programs in 4th quintile (% of population)
260,per_sa_allsa.cov_q1_tot,Coverage of social safety net programs in poorest quintile (% of population)
261,per_sa_allsa.cov_q5_tot,Coverage of social safety net programs in richest quintile (% of population)
262,per_lm_alllm.cov_pop_tot,Coverage of unemployment benefits and ALMP (% of population)
263,per_lm_alllm.cov_q2_tot,Coverage of unemployment benefits and ALMP in 2nd quintile (% of population)
264,per_lm_alllm.cov_q3_tot,Coverage of unemployment benefits and ALMP in 3rd quintile (% of population)
265,per_lm_alllm.cov_q4_tot,Coverage of unemployment benefits and ALMP in 4th quintile (% of population)
266,per_lm_alllm.cov_q1_tot,Coverage of unemployment benefits and ALMP in poorest quintile (% of population)
267,per_lm_alllm.cov_q5_tot,Coverage of unemployment benefits and ALMP in richest quintile (% of population)
268,IQ.CPA.HRES.XQ,CPIA building human resources rating (1=low to 6=high)
269,IQ.CPA.BREG.XQ,CPIA business regulatory environment rating (1=low to 6=high)
270,IQ.CPA.DEBT.XQ,CPIA debt policy rating (1=low to 6=high)
271,IQ.CPA.ECON.XQ,CPIA economic management cluster average (1=low to 6=high)
272,IQ.CPA.REVN.XQ,CPIA efficiency of revenue mobilization rating (1=low to 6=high)
273,IQ.CPA.PRES.XQ,CPIA equity of public resource use rating (1=low to 6=high)
274,IQ.CPA.FINS.XQ,CPIA financial sector rating (1=low to 6=high)
275,IQ.CPA.FISP.XQ,CPIA fiscal policy rating (1=low to 6=high)
276,IQ.CPA.GNDR.XQ,CPIA gender equality rating (1=low to 6=high)
277,IQ.CPA.MACR.XQ,CPIA macroeconomic management rating (1=low to 6=high)
278,IQ.CPA.SOCI.XQ,CPIA policies for social inclusion/equity cluster average (1=low to 6=high)
279,IQ.CPA.ENVR.XQ,CPIA policy and institutions for environmental sustainability rating (1=low to 6=high)
280,IQ.CPA.PROP.XQ,CPIA property rights and rule-based governance rating (1=low to 6=high)
281,IQ.CPA.PUBS.XQ,CPIA public sector management and institutions cluster average (1=low to 6=high)
282,IQ.CPA.FINQ.XQ,CPIA quality of budgetary and financial management rating (1=low to 6=high)
283,IQ.CPA.PADM.XQ,CPIA quality of public administration rating (1=low to 6=high)
284,IQ.CPA.PROT.XQ,CPIA social protection rating (1=low to 6=high)
285,IQ.CPA.STRC.XQ,CPIA structural policies cluster average (1=low to 6=high)
286,IQ.CPA.TRAD.XQ,CPIA trade rating (1=low to 6=high)
287,IQ.CPA.TRAN.XQ,"CPIA transparency, accountability, and corruption in the public sector rating (1=low to 6=high)"
288,AG.PRD.CROP.XD,Crop production index (2014-2016 = 100)
289,BN.CAB.XOKA.GD.ZS,Current account balance (% of GDP)
290,BN.CAB.XOKA.CD,"Current account balance (BoP, current US$)"
291,SE.XPD.CPRM.ZS,"Current education expenditure, primary (% of total expenditure in primary public institutions)"
292,SE.XPD.CSEC.ZS,"Current education expenditure, secondary (% of total expenditure in secondary public institutions)"
293,SE.XPD.CTER.ZS,"Current education expenditure, tertiary (% of total expenditure in tertiary public institutions)"
294,SE.XPD.CTOT.ZS,"Current education expenditure, total (% of total expenditure in public institutions)"
295,SH.XPD.CHEX.GD.ZS,Current health expenditure (% of GDP)
296,SH.XPD.CHEX.PC.CD,Current health expenditure per capita (current US$)
297,SH.XPD.CHEX.PP.CD,"Current health expenditure per capita, PPP (current international $)"
298,GC.TAX.IMPT.ZS,Customs and other import duties (% of tax revenue)
299,GC.TAX.IMPT.CN,Customs and other import duties (current LCU)
300,SP.DYN.CDRT.IN,"Death rate, crude (per 1,000 people)"
301,DT.TDS.DPPF.XP.ZS,"Debt service (PPG and IMF only, % of exports of goods, services and primary income)"
302,DT.TDS.DPPG.CD,"Debt service on external debt, public and publicly guaranteed (PPG) (TDS, current US$)"
303,DT.TDS.DECT.CD,"Debt service on external debt, total (TDS, current US$)"
304,PA.NUS.ATLS,DEC alternative conversion factor (LCU per US$)
